{
  "$schema": "https://json-schema.org/draft/2020-12/schema",
  "$id": "mapping-receipt.schema.json",
  "title": "mapping-receipt",
  "type": "object",
  "properties": {
    "schemaVersion": {
      "const": "3.1.0"
    },
    "template": {
      "type": "boolean"
    },
    "analysisId": {},
    "scope": {
      "type": "object"
    },
    "sources": {
      "type": "object"
    },
    "mapping": {
      "type": "object"
    },
    "storage": {
      "type": "object"
    },
    "checks": {
      "type": "object"
    },
    "businessVerification": {
      "type": "object"
    },
    "changes": {
      "type": "object"
    },
    "entry": {
      "type": "string"
    },
    "nextAction": {
      "type": "string"
    },
    "answerSync": {
      "type": "object"
    },
    "evidenceRetention": {
      "type": "object"
    }
  },
  "required": [
    "schemaVersion",
    "template",
    "analysisId",
    "scope",
    "sources",
    "mapping",
    "storage",
    "checks",
    "businessVerification",
    "changes",
    "entry",
    "nextAction",
    "answerSync",
    "evidenceRetention"
  ],
  "additionalProperties": false
}
